{
  "schema_version": "1.0",
  "roots": {
    "IMPORT": "./import"
  },
  "requested_modes": ["LIVE"],
  "requested_external": true,
  "inputs": [
    {
      "id": "external:afdocs",
      "mode": "LIVE",
      "root": "IMPORT",
      "path": "afdocs.json",
      "media_type": "application/json",
      "acquisition": {
        "kind": "IMPORTED",
        "producer": "afdocs"
      },
      "target": {
        "kind": "EXTERNAL_EVALUATION",
        "identity": "afdocs:https://docs.example.test"
      },
      "provenance": {
        "source": {
          "value": "afdocs",
          "trust": "USER_ASSERTED"
        },
        "observed_at": {
          "value": "2026-09-10T00:00:00.000Z",
          "trust": "USER_ASSERTED"
        },
        "authenticity": "UNVERIFIED"
      }
    }
  ],
  "mappings": []
}
